URL,Version,Status,OIDs,Name,Title,Description,Used
https://interop.esante.gouv.fr/ig/fhir/annuaire/CodeSystem/as-cs-organization-types,1.2.0-snapshot-1,draft,,AsCsOrganizationTypes,AS CodeSystem OrganizationTypes,"CodeSystem définissant les types d'organisation","ValueSet/as-vs-organization-types"
https://interop.esante.gouv.fr/ig/fhir/annuaire/CodeSystem/as-cs-type-etablissement,1.2.0-snapshot-1,draft,,AsCsTypeEtablissement,AS CodeSystem Type Etablissement,"CodeSystem définissant les types d'établissement.","ValueSet/as-vs-type-etablissement"
https://interop.esante.gouv.fr/ig/fhir/annuaire/CodeSystem/as-cs-type-systeme-information,1.2.0-snapshot-1,draft,,AsCsTypeSystemeInformation,AS CodeSystem type de système d'information,"CodeSystem définissant les types de systèmes d'information pouvant alimenter l'annuaire santé.","ValueSet/as-vs-type-systeme-information"
https://mos.esante.gouv.fr/NOS/TRE_G00-Langue/FHIR/TRE-G00-Langue,20240927120000,active,"1.2.250.1.71.2.10",TRE_G00_Langue,,"Langue","ValueSet/JDV-J82-Langue-RASS"
https://mos.esante.gouv.fr/NOS/TRE_G05-SousSectionTableauCNOP/FHIR/TRE-G05-SousSectionTableauCNOP,20231215120000,active,"1.2.250.1.71.4.2.6",TRE_G05_SousSectionTableauCNOP,,"Sous-Section du tableau de l'Ordre des Pharmaciens","ValueSet/fr-core-vs-practitioner-role-exercice,ValueSet/JDV-J73-MetierPharmacien-RASS"
https://mos.esante.gouv.fr/NOS/TRE_G09-DepartementOM/FHIR/TRE-G09-DepartementOM,20260505120000,active,"1.2.250.1.71.1.2.16",TRE_G09_DepartementOM,,"Référentiel des codes départements et collectivités d’outre-mer provenant du COG INSEE + Monaco. Cette TRE possède des propriétés spécifiques : Autorite Epars, pour indiquer le/ les ARS du département (tre-r396-autorite) et region pour indiquer le code de la région du département (TRE-R30-RegionOM)","ValueSet/JDV-J84-DepartementOM-RASS,ValueSet/JDV-J258-Departement"
https://mos.esante.gouv.fr/NOS/TRE_G15-ProfessionSante/FHIR/TRE-G15-ProfessionSante,20250328120000,active,"1.2.250.1.71.1.2.7",TRE_G15_ProfessionSante,,"Professions de santé définies par le code de la santé publique : professions médicales (art. L4111-1 à L4163-10), de la pharmacie et de la physique médicale (art. 4211-1 à 4252-3) et d’auxiliaires médicaux (art. 4311-1 à 4394-3)","ValueSet/JDV-J106-EnsembleProfession-RASS"
https://mos.esante.gouv.fr/NOS/TRE_R03-AttributionParticuliere/FHIR/TRE-R03-AttributionParticuliere,20231215120000,active,"1.2.250.1.71.1.2.27",TRE_R03_AttributionParticuliere,,"Attribution particulière","ValueSet/JDV-J90-AttributionParticuliere-RASS"
https://mos.esante.gouv.fr/NOS/TRE_R06-SectionTableauCNOP/FHIR/TRE-R06-SectionTableauCNOP,20231215120000,active,"1.2.250.1.213.2.37",TRE_R06_SectionTableauCNOP,,"Section du tableau de l'Ordre des Pharmaciens","ValueSet/fr-core-vs-practitioner-role-exercice,ValueSet/JDV-J73-MetierPharmacien-RASS"
https://mos.esante.gouv.fr/NOS/TRE_R17-TypeAutorisation/FHIR/TRE-R17-TypeAutorisation,20250523120000,active,"1.2.250.1.213.1.6.1.14",TRE_R17_TypeAutorisation,,"Type d'autorisation","ValueSet/JDV-J75-TypeAutorisation-RASS"
https://mos.esante.gouv.fr/NOS/TRE_R18-DisciplineAutorisation/FHIR/TRE-R18-DisciplineAutorisation,20231215120000,active,"1.2.250.1.213.1.6.1.67",TRE_R18_DisciplineAutorisation,,"Discipline d'autorisation","ValueSet/JDV-J76-DisciplineAutorisation-RASS"
https://mos.esante.gouv.fr/NOS/TRE_R20-Pays/FHIR/TRE-R20-Pays,20250328120000,active,"1.2.250.1.213.2.24",TRE_R20_Pays,,"Référentiel des codes pays provenant du COG INSEE","ValueSet/JDV-J256-Pays"
https://mos.esante.gouv.fr/NOS/TRE_R209-TypeActivite/FHIR/TRE-R209-TypeActivite,20240223120000,active,"1.2.250.1.213.2.2",TRE_R209_TypeActivite,,"Type d'activité","ValueSet/JDV-J138-TypeActivite-RASS"
https://mos.esante.gouv.fr/NOS/TRE_R21-Fonction/FHIR/TRE-R21-Fonction,20260223120000,active,"1.2.250.1.213.1.6.1.17",TRE_R21_Fonction,,"Fonction","ValueSet/JDV-J108-EnsembleFonction-RASS,ValueSet/fr-core-vs-practitioner-role-exercice"
https://mos.esante.gouv.fr/NOS/TRE_R22-GenreActivite/FHIR/TRE-R22-GenreActivite,20240329120000,active,"1.2.250.1.213.1.6.1.19",TRE_R22_GenreActivite,,"Genre d'activité","ValueSet/JDV-J94-GenreActivite-RASS,ValueSet/fr-core-vs-practitioner-role-exercice"
https://mos.esante.gouv.fr/NOS/TRE_R223-NatCycleForm/FHIR/TRE-R223-NatCycleForm,20231215120000,active,"1.2.250.1.213.1.6.1.115",TRE_R223_NatCycleForm,,"Nature du cycle de formation des étudiants","ValueSet/JDV-J86-NatCycleForm-RASS"
https://mos.esante.gouv.fr/NOS/TRE_R224-NiveauFormAcquis/FHIR/TRE-R224-NiveauFormAcquis,20231215120000,active,"1.2.250.1.213.1.6.1.116",TRE_R224_NiveauFormAcquis,,"Niveaux de formation acquis dans le cycle de formation des étudiants","ValueSet/JDV-J87-NiveauFormAcquis-RASS"
https://mos.esante.gouv.fr/NOS/TRE_R225-AnneeUniversitaire/FHIR/TRE-R225-AnneeUniversitaire,20251009120000,active,"1.2.250.1.213.1.6.1.117",TRE_R225_AnneeUniversitaire,,"Année universitaire","ValueSet/JDV-J88-AnneeUniversitaire-RASS"
https://mos.esante.gouv.fr/NOS/TRE_R23-ModeExercice/FHIR/TRE-R23-ModeExercice,20260202120000,active,"1.2.250.1.213.1.6.1.18",TRE_R23_ModeExercice,,"Mode d'exercice","ValueSet/fr-core-vs-practitioner-role-exercice,ValueSet/JDV-J95-ModeExercice-RASS"
https://mos.esante.gouv.fr/NOS/TRE_R24-TypeActiviteLiberale/FHIR/TRE-R24-TypeActiviteLiberale,20231215120000,active,"1.2.250.1.213.1.6.1.22",TRE_R24_TypeActiviteLiberale,,"Type d'activité libérale","ValueSet/JDV-J96-TypeActiviteLiberale-RASS,ValueSet/fr-core-vs-practitioner-role-exercice"
https://mos.esante.gouv.fr/NOS/TRE_R257-TypeBAL/FHIR/TRE-R257-TypeBAL,20231215120000,active,"1.2.250.1.213.3.3.55",TRE_R257_TypeBAL,,"Type de boîte aux lettres","ValueSet/JDV-J139-TypeBAL-RASS"
https://mos.esante.gouv.fr/NOS/TRE_R272-EquipementMaterielLourd/FHIR/TRE-R272-EquipementMaterielLourd,20231215120000,active,"1.2.250.1.213.1.6.1.124",TRE_R272_EquipementMaterielLourd,,"Equipements Matériels Lourds","ValueSet/JDV-J135-EquipementMaterielLourd-RASS"
https://mos.esante.gouv.fr/NOS/TRE_R274-ActiviteSanitaireRegulee/FHIR/TRE-R274-ActiviteSanitaireRegulee,20231215120000,active,"1.2.250.1.213.1.6.1.126",TRE_R274_ActiviteSanitaireRegulee,,"Activités sanitaires soumises à une régulation de la part de l'ARS","ValueSet/JDV-J133-ActiviteSanitaireRegulee-RASS"
https://mos.esante.gouv.fr/NOS/TRE_R275-ModaliteActivite/FHIR/TRE-R275-ModaliteActivite,20231215120000,active,"1.2.250.1.213.1.6.1.127",TRE_R275_ModaliteActivite,,"Mode d'application ou type de soins encadrant une activité","ValueSet/JDV-J132-ModaliteActivite-RASS"
https://mos.esante.gouv.fr/NOS/TRE_R276-FormeActivite/FHIR/TRE-R276-FormeActivite,20240329120000,active,"1.2.250.1.213.1.6.1.128",TRE_R276_FormeActivite,,"Type d'organisation de prise en charge","ValueSet/JDV-J134-FormeActivite-RASS"
https://mos.esante.gouv.fr/NOS/TRE_R282-CNAMAmeliSecteurConventionnement/FHIR/TRE-R282-CNAMAmeliSecteurConventionnement,20231215120000,active,"1.2.250.1.213.1.6.1.135",TRE_R282_CNAMAmeliSecteurConventionnement,,"Secteur de conventionnement du professionnel libéral par la CNAM extracts ameli","ValueSet/JDV-J130-CNAMAmeliSecteurConventionnement-RASS"
https://mos.esante.gouv.fr/NOS/TRE_R286-TypeFermeture/FHIR/TRE-R286-TypeFermeture,20260505120000,active,"1.2.250.1.213.1.6.1.136",TRE_R286_TypeFermeture,,"Type de fermeture, codes provenant du FINESS pour les EJ et EG","ValueSet/JDV-J260-TypeFermeture-RASS"
https://mos.esante.gouv.fr/NOS/TRE_R291-AutreProfession/FHIR/TRE-R291-AutreProfession,20231215120000,active,"1.2.250.1.213.1.6.1.140",TRE_R291_AutreProfession,,"Liste de professionnels non membres d'une profession réglementée","ValueSet/JDV-J106-EnsembleProfession-RASS"
https://mos.esante.gouv.fr/NOS/TRE_R302-ContexteCodeComplementaire/FHIR/TRE-R302-ContexteCodeComplementaire,20240426120000,active,"1.2.250.1.213.3.3.70",TRE_R302_ContexteCodeComplementaire,,"Liste des codes complémentaires utilisables dans un contexte particulier","ValueSet/JDV-J256-Pays"
https://mos.esante.gouv.fr/NOS/TRE_R31-StatutEtatCivil/FHIR/TRE-R31-StatutEtatCivil,20250131120000,active,"1.2.250.1.213.1.6.1.9",TRE_R31_StatutEtatCivil,,"Status de l'état civil","ValueSet/JDV-J111-StatutEtatCivil-ENREG"
https://mos.esante.gouv.fr/NOS/TRE_R32-StatutHospitalier/FHIR/TRE-R32-StatutHospitalier,20231215120000,active,"1.2.250.1.213.1.6.1.21",TRE_R32_StatutHospitalier,,"Statut hospitalier","ValueSet/JDV-J98-StatutHospitalier-RASS,ValueSet/fr-core-vs-practitioner-role-exercice"
https://mos.esante.gouv.fr/NOS/TRE_R33-StatutInscription/FHIR/TRE-R33-StatutInscription,20231215120000,active,"1.2.250.1.213.1.6.1.12",TRE_R33_StatutInscription,,"Statut de l'inscription","ValueSet/JDV-J85-StatutInscription-RASS"
https://mos.esante.gouv.fr/NOS/TRE_R34-StatutProfessionnelSSA/FHIR/TRE-R34-StatutProfessionnelSSA,20231215120000,active,"1.2.250.1.213.1.6.1.23",TRE_R34_StatutProfessionnelSSA,,"Statut du professionnel au SSA","ValueSet/JDV-J97-StatutProfessionnelSSA-RASS"
https://mos.esante.gouv.fr/NOS/TRE_R35-TypeVoie/FHIR/TRE-R35-TypeVoie,20231215120000,retired,"1.2.250.1.213.2.44",TRE_R35_TypeVoie,,"Type de voie","ValueSet/JDV-J103-TypeVoie-RASS"
https://mos.esante.gouv.fr/NOS/TRE_R60-AutoriteEnregistrement/FHIR/TRE-R60-AutoriteEnregistrement,20240628120000,active,"1.2.250.1.213.1.6.1.57",TRE_R60_AutoriteEnregistrement,,"Autorité d'enregistrement","ValueSet/JDV-J83-AutoriteEnregistrement-RASS"
https://mos.esante.gouv.fr/NOS/TRE_R72-FinessStatutJuridique/FHIR/TRE-R72-FinessStatutJuridique,20240329120000,active,"1.2.250.1.213.1.6.1.44",TRE_R72_FinessStatutJuridique,,"Statuts juridiques provenant de FINESS, excepté pour les codes 000 et 100 à 110 qui ont été ajoutés pour les besoins du RPPS en 2017.","ValueSet/JDV-J100-FinessStatutJuridique-RASS"
https://mos.esante.gouv.fr/NOS/TRE_R73-ESPIC/FHIR/TRE-R73-ESPIC,20231215120000,active,"1.2.250.1.213.1.6.1.45",TRE_R73_ESPIC,,"Etablissement de santé privé d'intérêt collectif","ValueSet/JDV-J162-ESPIC-RASS"
https://mos.esante.gouv.fr/NOS/TRE_R74-ModeFixationTarifaire/FHIR/TRE-R74-ModeFixationTarifaire,20251222120000,active,"1.2.250.1.213.1.6.1.46",TRE_R74_ModeFixationTarifaire,,"Mode de fixation tarifaire","ValueSet/JDV-J259-ModeFixationTarifaire-RASS"
https://mos.esante.gouv.fr/NOS/TRE_R85-RolePriseCharge/FHIR/TRE-R85-RolePriseCharge,20260505120000,active,"1.2.250.1.213.1.6.1.107",TRE_R85_RolePriseCharge,,"Rôle dans la prise en charge des patients ou des usagers","ValueSet/JDV-J108-EnsembleFonction-RASS,ValueSet/fr-core-vs-practitioner-role-exercice"
https://mos.esante.gouv.fr/NOS/TRE_R87-TypeCarte/FHIR/TRE-R87-TypeCarte,20231215120000,active,"1.2.250.1.213.1.6.1.106",TRE_R87_TypeCarte,,"Type de carte","ValueSet/JDV-J128-TypeCarte-RASS"
https://mos.esante.gouv.fr/NOS/TRE_R94-ProfessionSocial/FHIR/TRE-R94-ProfessionSocial,20241213120000,active,"1.2.250.1.213.1.6.1.4",TRE_R94_ProfessionSocial,,"Profession du social","ValueSet/JDV-J106-EnsembleProfession-RASS"
https://mos.esante.gouv.fr/NOS/TRE_R95-UsagerTitre/FHIR/TRE-R95-UsagerTitre,20241213120000,active,"1.2.250.1.213.1.6.1.109",TRE_R95_UsagerTitre,,"Usager de titre professionnel","ValueSet/JDV-J106-EnsembleProfession-RASS"
https://mos.esante.gouv.fr/NOS/TRE_R96-AutreFonctionSanitaire/FHIR/TRE-R96-AutreFonctionSanitaire,20231215120000,active,"1.2.250.1.213.1.6.1.110",TRE_R96_AutreFonctionSanitaire,,"Autres fonctions du domaine sanitaire","ValueSet/JDV-J108-EnsembleFonction-RASS,ValueSet/fr-core-vs-practitioner-role-exercice"
https://smt.esante.gouv.fr/fhir/CodeSystem/tre-r401-activite-sociale-regulee,20260330120000,active,"1.2.250.1.213.1.6.1.380",TreR401ActiviteSocialeRegulee,Tre R401 Activite Sociale Regulee,"Cette TRE hiérarchique remplace les éléments suivants : TRE_R280-DisciplineEquipementSocial, TRE_R298-AgregatDisciplineEquipSocNiv1, TRE_R299-AgregatDisciplineEquipSocNiv2, TRE_R300-AgregatDisciplineEquipSocNiv3 et ASS_X14_AgregatDisciplineEquipementSocial.  Cette TRE possède des propriétés spécifiques :  1. Le niveau d'agrégat des ASOCR de 1 à 4 (du plus large au plus fin) 2. Le parent d'un agrégat d'ASOCR ou d'une ASOCR 3. Les relations nécessaires à la construction des JDV dynamiques associés","ValueSet/jdv-j379-activite-sociale-regulee-rass"
https://smt.esante.gouv.fr/fhir/CodeSystem/tre-r403-public-activite-smsse-regulee,20260223120000,active,"1.2.250.1.213.1.6.1.382",TreR403PublicActiviteSmsseRegulee,Tre R403 Public Activite Smsse Regulee,"Cette TRE hiérarchique remplace les TRE actuelles TRE_R279-Clientele, TRE_R293-AgregatClienteleNiv2, TRE_R294-AgregatClienteleNiv3 et l'association ASS_X13-AgregatClientele. Cette TRE possède de nouvelles propriétés : le niveau d'agrégat des publics de 1 à 3 (du plus large au plus fin), le parent d'un agrégat de publics ou d'un public ainsi que les relations nécessaires à la construction des JDV dynamiques associés","ValueSet/jdv-j376-public-activite-smsse-regulee-rass"
